User review,Review date,Star review,Text length,Has media,Has answer,Written by bot
"Хорошие фильтры, не рвутся.",2024-09-17,5,27,0,1,0
Хорошие фильтры за недорого!👍,2024-09-12,5,29,0,1,0
Хорошие большие пакетики,2024-09-22,5,24,0,1,0
Беру не первый раз и очень довольна,2024-09-01,5,35,0,1,0
Очень плотная коробка. Фильтры упакованы в полиэтилен.,2023-11-11,5,54,1,1,0
"Отличные фильтры,ничего не рвется.",2024-09-02,5,34,0,1,0
Как всегда что ждали то и пришло!,2024-09-04,5,33,0,1,0
Хорошие фильтры,2024-03-20,5,15,1,1,0
Брак не советую покупать рвутся,2024-05-17,1,31,1,1,0
"Филттры хорошие ) но пришли без коробки в пакете , за это снижу звезду 😇 цена хорошая ! Спасибо",2024-02-09,4,95,1,1,0
"Хорошо фильтрует, осадка нет вообще. Пока все целые были.",2023-10-24,5,57,1,1,0
Очень удобно и кофеварка чистая,2024-09-03,5,31,0,1,0
"Ужасные фильтры! Пыталась заварить кофе, 5 штук подряд порваны либо плохо держатся и от попадания воды расклеиваются. Больше заказывать не буду.",2023-12-21,1,144,1,1,0
"вместо 300 шт.  приехала пачка 100шт….(((( \nЧто случилось со сборкой заказов???\nЕще раз перезаказывать не вижу смысла, опять ждать и опять не понятно как приедет. \n\nБрала ранее тут постоянно, уже очень много раз для капельной кофемашины. Пакеты отличные, все устраивало. Могли порваться, но  очень редко, примерно на 100 пакетов максимуи 1-2.",2024-07-21,5,342,0,1,0
Все пришло в отличном качестве,2024-09-03,5,30,0,1,0
"Не упаковано, коробка с пробоинами, но мешочки целые. В деле ещё не пробовал.",2023-07-06,5,77,1,1,0
"Пакеты рвутся , но не все. Может мне попался брак.",2024-09-24,3,50,0,1,0
Не проходит через него жидкость. Кофеварка суть не сгорела,2024-09-16,1,58,0,1,0
"Спасибо. Все отлично. Варю кофе каждый день, не одного брака! Фильтров",2023-09-16,5,70,1,1,0
"Пользуюсь фильтрами этого производителя всегда.Но именно это либо подделка,либо Эколюкс стал экономить на бумаге.Толщина фильтра в два раза тоньше,чем обычно,они просто прозрачные.При приготовлении большого количества кофе ( варю 1 литр в термос на работу) фильтр невозможно вытащить из кофеварки,рвётся от тяжести.На фото оригинальные,толстые фильтры этой фирмы",2023-08-06,3,362,1,1,0
"Фильтры вполне достойные, проклеены, без изъянов. Рекомендую.",2023-10-01,5,61,1,1,0
"Брали первый раз, думали что цена не соответствует качеству, но ошиблись. Продавцу спасибо. Хорошо, что не повелись на негативные отзывы. Ради интереса, заваривали кофе  2 раза в одном пакете и не порвался. \n Будем ещё заказывать.",2024-08-11,5,230,0,1,0
Пришёл товар в срок \nНо без транспортировочной пленки.\nЭто всё-таки для пищевых целей.\nКто знает в каких условиях он до меня добирался.\nСам фильтр сделан хорошо.,2023-09-19,4,161,1,1,0
"Фильтры хорошие, берем!",2024-09-13,5,23,0,1,0
Товар упакован в полиэтиленовый пакет. На заявленом фото была фирменная упаковка.,2024-02-12,3,81,1,1,0
"Некоторые расклеиваются, по остальному претензий нет.",2024-03-20,4,53,1,0,0
"Доставка пришла вовремя. Целостность упаковки не нарушена, за счет плотного картона. К покупке рекомендую",2023-04-17,5,105,1,1,0
Пришли хорошо упакованные.,2024-09-05,5,26,0,1,0
"Все супер. Ничего не рвется, и работает отлично, фильтры плотные. Для тупых - перед использованием подогните нижний край со швом и боковой и будет вам счастье.",2024-08-31,5,159,0,1,0
"Обычные, недорогие",2024-09-24,5,18,0,1,0
"Хорошие фильтры! Не рвутся, если использовать с кружкой! В принципе, как и должно быть! Хорошо фильтруют, я очень довольна! Спасибо продавцу и ВБ! рекомендую к покупке!",2024-08-27,5,168,0,1,0
"Хорошие фильтры, рекомендую",2024-09-01,5,27,0,1,0
"В этот раз товар действительно соответствует описанию. В прошлый раз прислали фильтры, но бумага была не очень хорошего качества, потому что быстро забивалась и уже не фильтровала.",2024-08-23,5,180,0,1,0
"Хороший размер, раньше брала 4,но те прям огромные, 2 для капельной кофеварки самое то. Бумага качественная, натуральный цвет.",2023-02-17,5,126,1,1,0
Упакованы хорошо. Но для моей кофеварки слишком огромные.,2024-09-08,4,57,0,1,0
"В упаковке 100 штук, размер 4, описанию соответствует. В магазине в 2 раза дороже. Смотрите фото!",2023-09-24,5,97,1,1,0
Очень хорошие фильтры,2024-09-14,5,21,0,1,0
Всё целое хорошие фильтры,2024-02-29,5,25,1,1,0
"Отличные пакеты, брали уже 2 раза, пока без нареканий. Брака не встречалось. Будем и дальше брать)",2023-09-21,5,98,1,1,0
Отлично подошли,2024-10-01,5,15,0,1,0
"Товар бракованный. Фото прилагаю, фильтры у основания дырявые",2024-01-07,1,61,1,1,0
"классные, покупаю уже второй раз!",2023-10-19,5,33,1,1,0
Расклеиваются как аллергик в период цветения растений.,2024-09-12,2,54,0,1,0
"Рвутся , вообще не пригодны",2024-05-08,2,27,1,1,0
"Пакеты хорошие, Но каробка пришла мятая и сырая",2023-12-19,5,47,1,1,0
"Дырявые. Начинаю лить воду, тут же рвутся (((",2024-09-18,1,45,0,1,0
"Когда первый раз покупала были отличные фильтры. Купила повторно, но в этот раз все не так хорошо. Очень много фильтров попадается бракованных, не запаены швы и все кофе высыпается наружу. В следующий раз уже эти брать не буду, попробую купить у другого продавца.",2023-08-30,2,263,1,1,0
"Фильтры отличные. Пользовались до 2021  оригиналом, пользуемся сейчас - разницы в потреб. качестве нет. Единственное упаковка - был картон стал целлофан. Спасибо производителю/продавцу.",2024-08-13,5,185,0,1,0
"Всем, кто пишет, что фильтры рвутся - они предназначены для использования в воронке, не надо их натягивать на чашку. Конечно фильтр под воздействием тяжести кофе и воды порвется. Купите вы воронку, она стоит рублей 500, только керамику, не экономьте и не берите пластик (трескается). И не будет ничего рваться.",2024-07-10,5,310,0,1,0
"Хорошие, рекомендую!",2024-09-09,5,20,0,1,0
"Отличные фильтры.Ничего не рвётся. Не слушайте тех умников,которые надевают эти фильтры на обычную кружку и таким образом пытаются сварить кофе. Фильтр устанавливается в кофеварку и прекрасно работает.Если хотите варить кофе в чашке - покупайте многоразовый пластиковый фильтр.",2024-07-18,5,277,0,1,0
Буду наслаждаться кофе!,2024-09-01,5,23,0,1,0
Всё отлично! Спасибо!,2024-03-03,5,21,1,1,0
Хороши. Благодарю,2024-09-17,5,17,0,1,0
К кофеварка подошли,2024-09-11,5,19,0,1,0
Хорошие фильтры,2024-09-24,5,15,0,1,0
"Фильтры хорошие, звезду сняла за отсутствие упаковки, хранить неудобно.",2024-01-31,4,71,1,1,0
Нормальные фильтры,2024-09-13,5,18,0,1,0
Нормальные фильтры,2024-09-13,5,18,0,1,0
Хорошие фильтры.,2024-09-20,5,16,0,1,0
"Отличные, рекомендую!",2024-09-04,5,21,0,1,0
Нормальные фильтры,2024-09-12,5,18,0,1,0
"Задумка хорошая, процентов может 10 брака, то прорывается, то не проходит вообще, но большинство отлично справляется, удобно для молотового кофе и дома и на работе.",2024-08-16,5,164,0,1,0
"Заказ 3 упаковки - получили. Одна из упаковок была порвана, но внутри всё цело. Товар качественный, без запаха. Стандартные пакетики.",2022-09-01,5,133,1,1,0
Соответствует описанию,2024-09-02,5,22,0,1,0
Отличные фильтры.,2024-01-29,5,17,1,1,0
"Упаковано отлично. Пришло быстро, спасибо",2023-12-20,5,41,1,1,0
Не держит совсем. Зря потраченные деньги.,2024-09-17,1,41,0,1,0
Отличные фильтры,2024-09-17,5,16,0,1,0
Фильтры рвутся под струёй воды!\nСначала порвался в кофеварке. Потом проверил под струёй холодной воды. Рвется шов на дне моментально\nНе рекомендую к покупке,2023-08-08,1,156,1,1,0
Отличные фильтры!!,2024-09-09,5,18,0,1,0
Хорошые,2024-05-19,5,7,1,1,0
"Хорошие фильтры, пользуюсь уже неделю, соответствуют размеру, не рвутся и не пропускают крупинки кофе.",2023-08-07,5,102,1,1,0
"Фильтры рвутся, попробовала уже  3 шт и один и тот же результат (",2024-01-31,1,65,1,1,0
Хорошие фильтры,2024-09-17,5,15,0,1,0
Фильтры подошли,2024-09-17,5,15,0,1,0
Хорошие вроде,2024-09-24,5,13,0,1,0
Каждый второй пакетик отказался с браком,2023-12-17,1,40,1,1,0
"Фильтры пришли без коробки, но в герметично запаянной упаковке",2024-01-30,4,62,1,1,0
"Были фильтры вот в таком состоянии. Всегда их покупала, не было нареканий, но в этот раз заметила, что фильтры не из той бумаги, что была раньше, тоньше стали что ли.Ну и плюс брак",2023-09-24,2,180,1,1,0
Хорошие фильтры,2024-09-14,5,15,0,1,0
Хорошие фильтры,2024-09-14,5,15,0,1,0
заказал большую упаковку 300 от. сплошной брак. Заявленный запатентованный шов (оказался) фэйком .,2023-08-06,1,98,1,1,0
"Фильтры отличные, доставка быстрая, упаковка целая👍",2023-11-02,5,51,1,1,0
По такой цене это просто находка! Три упаковки по 100 фильтров хватит на 10 месяцев ежедневного приготовления кофе!,2023-03-08,5,115,1,1,0
"Фильтры хорошие, качественные. Для кофеварки Russell Hobbs подошли идеально. Заказ пришёл вовремя. Продавца рекомендую",2022-11-15,5,118,1,1,0
"Рекомендую. Отличные фильтры. Не рвутся, не разтворяются, не размокают. Вмегла приходят в надежной упаковке. Имеют отличный товарный вид, не мятве, не порванные. Рекомендую продавца и сам товар. Безусловно буду покупать еще.",2024-07-14,5,224,0,1,0
"Хорошие фильтры. По ""шву"" не расходятся когда вставляешь в кофеварку.\nЗапаха не имеют. Привеуса не дают. Прочные, не размокают.\n\nЕдинственное, что мне не нравится, так это отсутствие вообще какой-либо дополнительной упаковки продавца.\nWB иногда не очень аккуратно везут товар. Если заводская коробка проткнётся, то и фильтры тоже. А этот товар не моется и преднизначен для приготовления продуктов питания...\nПоследний раз мне совсем без заводской коробки пришли фильтры (только внутренняя вакуумная пленка). У этого де продавца больше заказывать, конечно, не буду.",2024-05-08,5,564,0,1,0
"Отличные фильтры, чуть тоньше чем аналог Topperr, а почти в два раза дешевле с разницей 360 против 212. Рекомендую. Фунционально разницы нет.",2024-08-13,5,141,0,1,0
"Тоненькие, но для капельной вполне подходят",2024-09-01,4,43,0,1,0
"Фильтры плохие. Не рвутся, как указано во многих отзывах,но бумага очень плотная. При использовании в кофеварке капельного типа так как бумага ничего не фильтрует,вода накапливается и чаинки с током воды выходят через верх фильтра в кофе. Отвратно. Никогда ,ничего, при использовании других фильтров ,не наблюдалось.",2024-08-18,2,316,0,1,0
Отличные пакеты!,2024-09-05,5,16,0,1,0
Доставка быстрая и без задержки. Пакеты прочные. Спасибо продавцу и компании WB.Рекомендую к покупке,2024-08-30,5,100,0,1,0
"Фильтр бракованный. Кофе не фильтруется, шов не держит....",2023-11-28,1,58,1,1,0
Периодически разваливаются по шву.,2024-09-12,4,34,0,1,0
"Из пяти первых взятых фильтров, все пять с дырявым дном. Абсолютно невозможно их использовать",2023-11-29,1,93,1,1,0
Не кому не советую намокает и рвется,2024-09-09,1,36,0,1,0
Хорошие фильтры,2024-09-07,5,15,0,1,0
"Первый раз, когда заказывали эти фильтры, они пришли в коробке, в этот раз, просто в упаковке по 100 шт и в пакете.",2024-08-20,5,115,0,1,0
"Уже несколько раз приобретала данные фильтры, всегда всё было отлично, приходили в коробке и материал у фильтра был хорошим. \nСейчас заказав 300 шт. пришли в прозрачной упаковке и по качеству совсем не то, (просто бумага), что приходило раньше. Больше брать не буду у вас фильтры.",2024-08-20,1,280,0,1,0
"Обычные, но много не проклеенных в углу",2024-09-03,4,39,0,1,0
Хорошие фильтры!,2024-09-01,5,16,0,1,0
Хорошие фильтры,2024-09-05,5,15,0,1,0
"Хорошие фильтры. Для кофеварки на 6 кружек, в самый раз. Не размокают и не рвутся. Запаха бумаги нет. Кофе получается без осадка.",2022-08-28,5,129,1,1,0
Отличные.,2024-10-01,5,9,0,1,0
"Фильтры норм. Плотность бумаги достаточная, напиток и гущу держат (использую в капельной кофеварке), шов крепкий, размерность двойка - тютелька в тютельку (на фото - кофейная 70мл чашечка для сравнения)\nТоваром доволен, спасибо продавцу!",2022-11-21,5,237,1,1,0
Некоторве рвутся после намокания,2024-09-11,4,32,0,1,0
"Пользуюсь такой кофемашинкой лет 5, такая ситуация у меня впервые 🙈\nРаньше покупала пакеты в магазине, а тут решила заказать.. \nФильтр просто развозился 🥲",2023-09-11,1,154,1,1,0
"Отличные фильтры, достаточно тонкие, но свою задачу хорошо выполняют. Все хорошо упаковано было и сама коробка и фильтры внутри.",2022-12-24,5,128,1,1,0
"Спасибо! Фильтры очень хорошие! Запаха нет, кофе вкусный! Буду заказывать еще. Рекомендую!",2024-08-30,5,90,0,1,0
"Хорошие фильтры, герметичная упаковка. 👍👌",2023-11-06,5,41,1,1,0
"Рекомендую продавца и товар. Уже заварила в пакетике кофе, довольна.",2023-03-01,5,68,1,1,0
"Отличные фильтры. Не рвутся, не размокают.  Заказ пришел в надежной упаковке. Имеют отличный товарный вид, не мятые, не порванные. Рекомендую продавца и сам товар. Буду заказывать еще.",2024-07-14,5,184,0,1,0
Брали для кофеварки  Тефаль .Фильтры хорошие. Крепкие.,2023-07-03,5,54,1,1,0
"Хорошие,не намокают.можно пользовать до трёх раз,если есть необходимость т.е экономичные.",2024-08-27,5,89,0,1,0
"Полная ерунда. От горячей воды разрывается, подумали мало ли брак на фильтре первом, а так все 5 штук, что пытались использовать",2023-09-26,1,128,1,1,0
"Уже многие писали про «опилки» и ошметки бумаги, которые сыпятся по краям с фильтров. Сначала думала, что ничего страшного и перед каждым применением стряхивала и сручную проходилась по каждому краю фильтра, чтобы потом не пить кофе с кусками бумаги. Но спустя около 20 таких танцов с бубном выкинула всю пачку и заказала у другого продавца. Крайне не рекомендую, если вам дорого ваше время и кофе, который вы пьете",2024-07-17,1,415,0,1,0
"Фильтры очень плохо спаянны, сразу расходится шов уже в руках, не говоря о наливание в них кипятка...",2023-10-29,3,101,1,1,0
"Уже давно пользуюсь капельной кофеваркой и много раз заказывала именно эти фильтры. Всегда все было отлично. В этот раз фильтры ужасного качества. Рвутся, швы расходятся просто от воды. А через кофе вода вообще не проходит. Сначала грешила на кофеварку, но при попытке пролива через воронку такой же результат.",2024-08-05,2,310,0,1,0
Плохо пропускает а потом рвется,2024-09-07,3,31,0,1,0
Отличные фильтры. Упакованы надежно,2023-11-09,5,35,1,1,0
"По качеству в использовании все хорошо. Но,  конечно, хранение удобно в коробке,  а не в плёнке как сейчас.",2024-08-10,5,107,0,1,0
"Кофе завариваю в чашке, попробовала впервые через фильтр без воронки, спасибо, не порвался. намного вкуснее, мягче, чашка у меня небольшая",2024-07-26,5,138,0,1,0
"Без оригинальной упаковки, завальцованы в простой пакет. При использовании фильтруют очень медленно и до половины. Большие сомнения, что оригинал. Раньше неоднократно заказывала такие же, проблем не было.",2024-08-25,2,204,0,1,0
"Замечательные фильтры. По размеру кофеварки. Плотные, не рвутся и не протекают. Покупкой довольны.",2024-08-14,5,98,0,1,0
"Ставлю 3 звезды за то что продавец вводит в заблуждение покупателя своей инструкцией по применению, эти фильтры используются только с воронкой или в кофеварки, просто положить его в чашку не получиться, когда его вытаскиваеш дно рвется кофеинки остаются в бакале, и медленно капает вода, пока дождёшься  кофе пьешь уже чуть теплый.",2024-07-26,3,331,0,1,0
"Деньги на ветер! При взаимодействии с водой шов расклеивается. Если подвернуть где нет шва и придерживать, то получается отфильтровать. К покупке не рекомендую.",2023-08-01,1,160,1,1,0
"Начиталась хороших отзывов, понадеялась. У трех фильтров просто разошёлся нижний шов от воды, три раза пришлось отмывать кофеварку(",2023-09-05,3,131,1,1,0
"Заказ пришёл быстро )коробка была чудь помята а так все отлично с -фильтрами ,на мою машинку  отлично подошли ,фильтры не  тонкие рекомендую !👍",2022-01-24,5,143,1,1,0
"Хорошие фильтры! Не поленилась и посчитала - действительно 100штук, все честно! Упакованы в 2 пакетика, все пришло в сохранности. Спасибо! буду покупать у вас еще!",2024-07-11,5,163,0,1,0
