User review,Review date,Star review,Text length,Has media,Has answer,Written by bot
"Ужасно пропускают воду. Приходится несколько раз ставить на паузу кофеварку, чтобы вода не вылилась из резервуара с фильтром. До этого брала эту же фирму, но в меньшем количестве. Таких проблем с ними не было. Есть подозрения, что продавец под этим брендом продаёт подделку. Фильтры пришли без коробки (при заказе меньшего количества фильтры были в фирменной коробке), просто упакованые в прозрачную пленку, на упаковке не был отмечен бренд.",2024-07-04,2,441,0,1,0
"Всё хорошо, фильтры те что нужно.",2023-08-21,5,33,1,1,0
"Отличные фильтры . Доступная цена. Не рвутся, постороннего запаха нет, не забиваются. Что ещё понравилось- помимо того что коробка в целлофане, и сами фильтры внутри тоже упакованы в целлофан. Рекомендую.",2021-12-30,5,204,1,1,0
"Отлично подошли к кофеварке нашей, а то надоело мыть каждый раз ситечко.",2024-08-28,5,72,0,1,0
"На коробке написано что отбелённые,а по факту не отбеленные))хорошо что в пункте выдачи я заглянула в коробочку)",2023-04-01,5,112,1,1,0
Все супер,2024-09-13,5,9,0,1,0
"Качество оставляет желать лучшего.... Всегда использую фильтры для заваривания в чашке, но первый раз вижу чтобы фильтры расклеивались.",2023-05-12,1,135,1,1,0
Для капельной кофеварки отлично подходит. Не расклеиваются. Смотрите назначение на коробке и все будет отлично.,2024-07-30,5,111,0,1,0
"Хорошего качества, но немного размер большеват, я подрезал. Не критично",2024-08-26,5,71,0,1,0
"Отличная цена для таких фильтров.. В магазинах стоят в два, а то и в три раза дороже.. \nХорошо фильтруют. Не рвутся.",2024-07-28,5,116,0,1,0
"Фильтры очень плотные,хорошего качества. Советую ! Брала 200шт. Ни один не порвался и не расклеился при использовании .👍",2024-07-25,5,120,0,1,0
"По качеству такие же,  как покупала в магазине, все отлично. Свою функцию выполняют.",2024-08-16,5,84,0,1,0
"Что-то вообще не пойму, это ужас а не пакеты!!! Всё время заказываю у вас, и всё было отлично. В этот раз пришли во-первых не так упакованы, а просто в полиэтилен. Не придала значение. Кофе вообще ужасный получается, а кофе тот же!!! Кофе слабый, и сами пакеты с каким-запахом! Больше здесь брать не буду!!!",2024-07-18,1,307,0,1,0
"Вроде все норм,сам не правильно пользовался,аппарата не было использовал в стакане",2024-08-13,5,82,0,1,0
Нормальные.,2023-12-23,5,11,1,1,0
"Хорошие фильтры\nКоробка немного помята, но фильтры в отдельном пакете, так что все норм!\nРазмер соответствует заявленному",2022-08-20,5,121,1,1,0
"Очень люблю эти фильтры, покупаю постоянно, спасибо производителю",2024-08-26,5,65,0,1,0
"Как и все, не прочитал сразу отзывы. Возможно, ранее были хорошего качества, сейчас не возможно даже 1 чашку заварить, сразу рвет дно. Хоть пустой, хоть с кофе - без разницы. Выкинул деньги на ветер. Хорошо, что на запас не взял.",2024-08-04,1,229,0,1,0
"Фильты  хорошего качества, но  необратила внимание на размер ) оставила, использую",2024-08-12,5,82,0,1,0
"К сожалению, фильтры оказались плохими. За много лет использования подобных фильтров впервые столкнулась с тем, что, во-первых, они ооочень медленно пропускают воду, а во-вторых рвутся! Возможно, эти проблемы связаны. Поскольку фильтр плохо пропускает воду, он долго находится в мокроом состоянии, и бумага не выдерживает. Не знаю. Очень жалко. Куплена большая упаковка, и как ими пользоваться, неизвестно. Видимо, никак.",2024-06-27,2,421,0,1,0
Отлично.,2024-09-12,5,8,0,1,0
Всё супер,2024-09-05,5,9,0,1,0
"Упаковка была поняла, но я брала для себя и по этому не критично. Сами фильтры отличные. Не рвутся. Рекомендую!!!",2022-09-02,5,113,1,1,0
"Неожиданно,  что без коробки",2024-02-10,4,28,1,1,0
"Зачем дезинформировать покупателей, что фильтры произведены в Германии? На упаковке написано - изготовитель Россия, и штрих-код российский! Никаких ""сделано в Германии"" нет! Коробка очень неудобно открывается, нет никакого клапана для дальнейшего хранения и использования фильтров",2023-02-16,3,280,1,1,0
"Фильтры нормальные брала двоечку но мне приходится обрезать верх, это не проблема, спасибо производителю и продавцу",2022-01-26,5,115,1,1,0
"Не очень понимаю, что может расползаться. Отличные фильтры.",2024-08-28,5,59,0,1,0
Нормальные пакеты для кофемашины 👍 всё работает хорошо рекомендую.,2024-08-21,5,66,0,1,0
"Приобретением довольна, заказ получила через 2 дня. Упаковка не повреждена и сами фильтры упакованы в пленку👍",2022-02-20,5,109,1,1,0
"Отличный фильтры, уже раз 5 заваривала в них кофе, используя кофеварку. Хорошая цена и качество",2023-03-23,5,95,1,1,0
"Дешевле стоят на валберис, чем в магазине. Фильтры отличные, без нареканий. Ежедневно использую для кофеварки капельного типа. Рекомендую.",2022-04-25,5,138,1,1,0
"Заказывал у этого продавца фильты 100шт, они были чуть лучше. У этих (200шт) один фильтр расклеился и весь кофе стёк по пуроверу в кружку, но это мелочи! Продавца советую, товар хороший!",2024-06-13,5,186,0,1,0
Хорошие,2024-09-12,5,7,0,1,0
"Отличные фильтры, лучше чем ранее покупала в окее. Доставка быстрая, качество огонь!",2022-06-28,5,84,1,1,0
"Хорошо упакованы, плотные, качественные, буду заказывать ещё",2024-08-23,5,60,0,1,0
"Использовала в кофеварке. Так как бумага плотная, то кофе пришлось подождать, но спустя несколько часов так и осталась в этом фильтре вода. Бумага имеет жуткий запах. Да, кофе был Турецкий мёд, но в итоге в чашке этого вкуса не было. Запах бумаги удалил и вкус кофе.",2024-07-18,3,266,0,1,0
"Дождался я свои фильтра, как налил кипятка сразу же дно открылось и вода вместе с кофе вылилось в стакан. Подумал ладно, может одна штука брак, еще 10 использовал та же фигня, думаю ок, использовал сразу 3 вложив друг в друга, то же самое. В общем не советую, бесполезная штука.",2024-07-15,1,278,0,1,0
"Отличные, привкуса бумаги в кофе не чувствуется. Для пуровера подошли. Крепкие, пока ни один не расклеялся.",2022-08-05,5,107,1,1,0
Супер!,2024-09-17,5,6,0,1,0
"Фильтры плотные, упакованы были хорошо. Продавца рекомендую, будем брать ещё.",2024-08-05,5,77,0,1,0
"Очень разочарована. Было заказано 300 штук. Оплата прошла за 300. В пункте забрали только 100. Про получении не обратили внимания (наша оплошность), а дома уже разобрались. Продавец оказался не честен.",2022-11-07,1,201,1,1,0
"Как только не пробовала....дно рвётся, хоть в воронке,  хоть в кружке....Полное разочарование 😞 Брала у другого производителя,  все было прекрасно. Очень жаль.",2024-08-15,1,159,0,1,0
Отличные фильтры! Никаких крошек или чего там нашли другие люди кроме самих фильтров.,2024-07-30,5,85,0,1,0
"Этими фильтрами пользуюсь давно ,все устраивает спасибо",2024-08-25,5,55,0,1,0
хорошие,2024-09-07,5,7,0,1,0
"Цена =качество, для бюджетных фильтров отлично, плотные, 5+",2023-06-06,5,59,1,1,0
"Пришли в мятой и надорванной коробке. Сама она и фильтры внутри запаяны в пленку, но все равно неприятно - коробку обычно ставлю на виду. Качество, надеюсь, будет ОК. ",2022-08-17,4,167,1,1,0
"Каждый день мой кофе грязный, фильтры рвутся либо изначально дырявые, жаль что я три коробки купила",2023-08-18,2,99,1,1,0
"Вроде неплохие фильтры, правда, для нашей кофеварки немного великоваты😅.",2024-08-08,5,72,0,1,0
Фильтры в пачке из последнего заказа дырявые через один 🤷‍♀️,2023-10-27,1,60,1,1,0
"Фильтры-то ок: кофе заварила, постороннего ничего нет, но с упаковкой нужно что-то делать: она в уголке мятая так прилично. Или ВБ неаккуратно привезли, или продавец недостаточно упаковал. Но сами фильтры без повреждений. За такие деньги супер.",2021-11-28,5,244,1,1,0
Хорошие,2024-09-06,5,7,0,1,0
Хорошие фильтры. Работу свою выполняют. Бракованный дырявых фильтров пока не находила. Доставили быстро.,2024-07-14,5,104,0,1,0
Все ок,2024-09-13,5,6,0,1,0
"Тонкие ,но прочные . Описанию соответствует , постороннего запаха нет .",2022-12-09,5,71,1,1,0
"Отличные пакеты, подходят к моей капельной кофеварке",2023-03-08,5,52,1,1,0
Описанию соответствует.В упаковке две коробки по 100 шт.,2022-06-21,5,56,1,1,0
"Такие же как и в любой кофейне или  *** , только в два раза дешевле. По этому спасибо.",2024-07-24,5,86,0,1,0
Не рекомендую,2024-09-23,3,13,0,1,0
"Понравились. Под них обязательно нужна опора, многоразовый фильтр или воронка для кофе.",2024-07-24,5,87,0,1,0
"Товар пришёл вовремя, процеживают отлично, нареканий никаких нет. Советую к покупке.",2022-04-04,5,84,1,1,0
"Фильтры пришли не в коробке, как это изображено на фото, и как это должно быть, а в запаянном целофане. Мерзость. Такое ощущение, что их в подвале кто-то по 100 штук отсчитываться и упаковывает.",2024-07-30,2,194,0,1,0
"Пришло всё целое, заваривает отлично, всё супер",2022-09-04,5,47,1,1,0
"Плохо склеены или еще что, но что ни фильтр, то рвется в центре, в итоге пьешь кофе с кофейной гущей либо фильтрация не происходит, забивается, одно расстройство",2024-08-09,1,161,0,1,0
"Упаковка пришла нормальная, но сама по себе она крайне хлипкая, сразу выкинул, не хочется в ней хранить эти фильтры. Сами фильтры оч достойные!",2021-11-08,5,143,1,1,0
"Пришло во время, все целое.",2023-10-03,5,27,1,1,0
Отличные фильтры. Очень удобно.,2023-09-12,5,31,1,1,0
"Пришли в такой коробке, не знаю как будут в действии, думаю что хорошие..",2022-11-14,5,73,1,1,0
"Как в описании, ни какого постороннего запаха нет, кофе чистое",2024-08-13,5,62,0,1,0
"Для заварки пуровером не подходят, рвутся все стабильно, даже просто от воды",2023-09-13,1,76,1,1,0
"Отличные фильтры, дешевле наполовину аналогичных, которые брала всегда. Разницы не увидела. Берите.",2024-07-13,5,99,0,1,0
Отличные! Не один не порвался ( пользуюсь каждый день )!Рекомендую!!!,2024-08-05,5,69,0,1,0
"Очень плохие фильтры,буквально каждый рвется по шву\nДаже если делать двойные,все равно не выдерживают и рвутся\nКатегорически не советую!",2024-08-18,1,136,0,1,0
Отлично,2024-09-01,5,7,0,1,0
"Хорошо фильтруют, кофе фильтр получается классный",2024-08-25,5,49,0,1,0
Удобно,2024-09-08,5,6,0,1,0
Фильтры хорошие. Размер совпадает с заявленным,2024-08-28,5,46,0,1,0
"Мне понравились. Свою функцию выполняют, запаха нет и цена хорошая",2024-08-05,5,66,0,1,0
"Ой ну не знаю, у кого там что разваливается, если все с умом делать, то они суперски упрощают  жизнь кофеварки и мне( что вымывать кофе не нужно), достал фильтр-выкинул в мусорку, было даже что забывала в спешке выкинуть фильтр и только к вечеру вспоминала, и он тоже не разваливается.акуратно подогнули швы, вставили в кофемашину и засыпали кофе, насильно его рвать и протыкать( проверяя на прочность)  не нужно.  У меня на этом все, всем спасибо, все свободны.бомбануло😅",2024-03-08,5,472,0,1,0
отличные фильтры. и не надо переплачивать. такие же как дорогие,2024-08-07,5,63,0,1,0
"Фильтры пришли в пленке, без дополнительной упаковки. К счастью, ничего не помялось и не порвалось. Жду доставку кофе, чтобы посмотреть на них в деле)",2022-07-17,5,150,1,1,0
"Хорошие пакеты , использую для кофеварки\nНе рвались",2024-08-19,5,51,0,1,0
Хорошие.,2024-02-08,5,8,1,1,0
"Хорошие фильтры, заказываю уже не в первый раз 👍 . Упаковка целая, сами фильтры внутри тоже были упакованы в плёнку. Спасибо продавцу и Вайлдберриз за быструю доставку!",2022-05-13,5,168,1,1,0
"Заказываю такие фильтры 2 раз, раньше брала 100 штук, сейчас решила заказать 200. Пришли быстро, упакованы в пластиковый пакет, раньше были в коробке, на качество фильтров не влияет. Спасибо, будем пить вкусные кофе и чай",2024-05-11,5,221,0,1,0
"Пакеты плотные, для моей маленькой кофемашины большие. Но качественные 👍",2024-07-28,5,72,0,1,0
На свою кофеварку фильтр подрезаю по высоте. Остальное норм👍,2022-02-26,5,60,1,1,0
Всё пришло в целости. Продавца рекомендую.,2024-08-30,5,42,0,1,0
Нормальный Осадка в кофе нет.Мге нравится,2024-08-30,5,41,0,1,0
"Фильтры хорошие. Если не в машину, - то помол должен быть по крупней. Упор нужен.",2024-07-19,5,81,0,1,0
"Отличные фильтры. Без фирменной упаковки, надо придумать как хранить . Зато цена- качество- количество- отлично! 100 шт за 190₽",2024-06-19,5,127,0,1,0
"Фильтры хорошие. А вот упаковка мятая, рваная. сколько уже негативных отзывов и претензий у покупателей к упаковкам, вообще в службе доставки как-нибудь обращают внимание на это?",2022-03-09,5,178,1,1,0
"Используем в кофеварке Tefal, всё отлично.",2024-08-27,5,42,0,1,0
"Очень удобные пакеты\nХорошо ложиться в форму. Плотные,качественные. Брала 2-й раз. Рекомендую.",2024-07-08,5,94,0,1,0
"Беру эти фильтра не первый раз, и ещё возму.",2024-08-25,5,44,0,1,0
Огромное кол-во брака. Рвутся один за другим . Некоторые уже с дырками.,2023-09-01,1,71,1,1,0
"Покупала для кофеварки, которой полтзуетс свекровь. Она осталась довольна. До этого подобные фильтры ей привозили из Германии. Это вполне хороши",2024-06-07,5,144,0,1,0
"Не вскрывала. Уверена, что все в норме",2023-07-14,5,38,1,1,0
"Очень полезная штука,кофеварка всегда чистая и нет проблем как высыпаться гущу!!!",2024-07-16,5,81,0,1,0
"Большие, как раз для капельной кофеварки. Хорошее качество",2024-08-07,5,58,0,1,0
"Упаковано отлично,но сами фильтры очень тонкие и с дырками",2023-09-29,1,58,1,1,0
"Что надо,кж дешевле, чем в магазине, и не хуже Германии",2024-08-09,5,55,0,1,0
"По качеству ничем не отличается от более дорогих. Даже есть плюс, отдельно упакованы в пакет. Все хорошо, спасибо продавцу ✌️",2022-08-27,5,125,1,1,0
"Беру не первый раз, нравится что в кофе благодаря им нет мелкой взвеси.",2024-07-24,5,71,0,1,0
"Качество ужасное, сразу порвалось. Туалетная бумуга и то крепче. \nК сожалению пришлось выбросить вместе с порцией очень качественного и дорогого кофе, что в двойне обидно. Деньги на ветер, вся упаковка в мусорке.",2024-07-10,1,212,0,1,0
Говно. Проклеены отвратительно.  прорываются при первом же наливе воды .,2023-08-21,1,72,1,1,0
"Разваливается при контакте с кипятком. Как такое г***но можно за деньги продавать, вообще не куда не годится. Я в таком разочаровании.",2024-08-07,1,134,0,1,0
"Фильтры хорошие, рекомендую к покупке.",2024-08-28,5,38,0,1,0
"качество хорошее, плюс экономия за количество",2024-08-19,5,45,0,1,0
"Хорошие фильтры, но кладу их в сито потому что рвутся.",2024-08-08,5,54,0,1,0
Отлично подошли на капельную кофеварку браун,2024-08-19,5,44,0,1,0
Отличные фильтры. беру не в первый раз.,2024-08-26,5,39,0,1,0
"Хорошие фильтры! Спасибо, что удешевили товар за счёт упаковки!",2024-07-29,5,63,0,1,0
"давно мечтала о таких, что бы не засорять кофейной гущей мойку!!",2024-07-28,5,64,0,1,0
"На вид все хорошо. Ещё не использовали. Но, думаю, проблем не будет. Благодарю за доставку и упаковка.",2024-06-26,5,102,0,1,0
"Очень нравятся эти фильтры, заказываю не первый раз. Спасибо продавцу.",2024-07-22,5,70,0,1,0
Отличные пакеты для любимого кофейка🤟👍👍👍😁,2022-07-13,5,41,1,1,0
Спасибо берём не первый и надеюсь не последний раз,2024-08-11,5,50,0,1,0
"Плотные, не рвутся, а главное кофеварка всегда чистая!!! Спасибо за товар! Рекомендую 100%",2024-07-03,5,90,0,1,0
"Хорошо упакованы, запаха нет, никакого привкуса кофе не дают",2024-07-29,5,60,0,1,0
"Заменил обычный фильтр в кофеварке на бумажный, вкус кофе улучшился.",2024-07-21,5,68,0,1,0
"Обычные фильтра. Все норм. Но запоковывать стали, просто ужасно, в обычном прозрачном пакете",2024-07-01,5,92,0,1,0
"Не первый раз покупаю такие фильтры, к их качеству вопросов нет, но коробки пришли помятые и при целой внешней пленке внутри была продырявленная коробка, неприятно",2022-02-07,5,163,1,1,0
"Я понимаю что это не герметичный продукт😡но пинать ногами покупку это слишком😡я конечно выкупила, так это себе брала! А если бы заказывала на подарок? Вся пробита, порванная😡",2022-08-21,3,174,1,1,0
"Не первый раз покупаю, для кофеварки отличные фильтр- пакеты. Рекомендую!",2024-07-16,5,73,0,1,0
